Authors,Author(s) ID,Title,Year,Source title,Volume,Issue,Art. No.,Page start,Page end,Page count,Cited by,DOI,Link,Affiliations,Authors with affiliations,Author Keywords,Index Keywords,Correspondence Address,Document Type,Publication Stage,Access Type,Source,EID
"Jiang K., Poppenberg K.E., Wong L., Chen Y., Borowitz D., Goetz D., Sheehan D., Frederick C., Tutino V.M., Meng H., Jarvis J.N.","27172302400;57200309797;57190136775;14017814200;35516822300;56878593700;7101617271;56158610100;56079359900;55816054800;57203234818;","RNA sequencing data from neutrophils of patients with cystic fibrosis reveals potential for developing biomarkers for pulmonary exacerbations",2019,"Journal of Cystic Fibrosis","18","2",,"194","202",,2,"10.1016/j.jcf.2018.05.014","https://www.scopus.com/inward/record.uri?eid=2-s2.0-85048870962&doi=10.1016%2fj.jcf.2018.05.014&partnerID=40&md5=954eb4b4237478ca34f95d1b0b1762b2","Department of Pediatrics, Pediatric Rheumatology Research, University at Buffalo, Jacobs School of Medicine and Biomedical Sciences, Clinical and Translational Research Center, 875 Ellicott St, Buffalo, NY  14203, United States; Department of Biomedical Engineering, University at Buffalo, Jacobs School of Medicine and Biomedical Sciences, Clinical and Translational Research Center, 875 Ellicott St, Buffalo, NY  14203, United States; Department of Pediatrics, Pulmonology Section, University at Buffalo, Women and Children's Hospital of Buffalo, 239 Bryant St, Buffalo, NY  14203, United States; Department of Medicine, Section on Pulmonary, Critical Care, and Sleep Medicine, Buffalo General Medical Center Heart and Lung Center, 219 Bryant St./100 High St. B-8, Buffalo, NY  14222, United States","Jiang, K., Department of Pediatrics, Pediatric Rheumatology Research, University at Buffalo, Jacobs School of Medicine and Biomedical Sciences, Clinical and Translational Research Center, 875 Ellicott St, Buffalo, NY  14203, United States; Poppenberg, K.E., Department of Biomedical Engineering, University at Buffalo, Jacobs School of Medicine and Biomedical Sciences, Clinical and Translational Research Center, 875 Ellicott St, Buffalo, NY  14203, United States; Wong, L., Department of Pediatrics, Pediatric Rheumatology Research, University at Buffalo, Jacobs School of Medicine and Biomedical Sciences, Clinical and Translational Research Center, 875 Ellicott St, Buffalo, NY  14203, United States; Chen, Y., Department of Pediatrics, Pediatric Rheumatology Research, University at Buffalo, Jacobs School of Medicine and Biomedical Sciences, Clinical and Translational Research Center, 875 Ellicott St, Buffalo, NY  14203, United States; Borowitz, D., Department of Pediatrics, Pulmonology Section, University at Buffalo, Women and Children's Hospital of Buffalo, 239 Bryant St, Buffalo, NY  14203, United States; Goetz, D., Department of Pediatrics, Pulmonology Section, University at Buffalo, Women and Children's Hospital of Buffalo, 239 Bryant St, Buffalo, NY  14203, United States; Sheehan, D., Department of Pediatrics, Pulmonology Section, University at Buffalo, Women and Children's Hospital of Buffalo, 239 Bryant St, Buffalo, NY  14203, United States; Frederick, C., Department of Medicine, Section on Pulmonary, Critical Care, and Sleep Medicine, Buffalo General Medical Center Heart and Lung Center, 219 Bryant St./100 High St. B-8, Buffalo, NY  14222, United States; Tutino, V.M., Department of Biomedical Engineering, University at Buffalo, Jacobs School of Medicine and Biomedical Sciences, Clinical and Translational Research Center, 875 Ellicott St, Buffalo, NY  14203, United States; Meng, H., Department of Biomedical Engineering, University at Buffalo, Jacobs School of Medicine and Biomedical Sciences, Clinical and Translational Research Center, 875 Ellicott St, Buffalo, NY  14203, United States; Jarvis, J.N., Department of Pediatrics, Pediatric Rheumatology Research, University at Buffalo, Jacobs School of Medicine and Biomedical Sciences, Clinical and Translational Research Center, 875 Ellicott St, Buffalo, NY  14203, United States","Biomarkers; Cystic fibrosis; Neutrophils; RNA; Sequencing; Transcriptome","biological marker; carrier proteins and binding proteins; long untranslated RNA; membrane protein; multidrug resistance associated protein 14; multidrug resistance associated protein 8; transcriptome; unclassified drug; adult; Article; blood sampling; child; clinical article; convalescence; cystic fibrosis; deterioration; disease activity; disease exacerbation; enzyme linked immunosorbent assay; exon; female; forced expiratory volume; human; intron; lung fibrosis; lung function; machine learning; male; neutrophil; protein expression; real time polymerase chain reaction; RNA sequence; school child; transcription initiation site; treatment response; young adult","Jarvis, J.N.; Department of Pediatrics, Pediatric Rheumatology Research, University at Buffalo, Jacobs School of Medicine and Biomedical Sciences, Clinical and Translational Research Center, 875 Ellicott St, United States; email: jamesjar@buffalo.edu",Article,"Final",,Scopus,2-s2.0-85048870962
"Bhadane A., Mane S.B.","57207734661;36701576900;","Detecting lateral spear phishing attacks in organisations",2019,"IET Information Security","13","2",,"133","140",,,"10.1049/iet-ifs.2018.5090","https://www.scopus.com/inward/record.uri?eid=2-s2.0-85062798773&doi=10.1049%2fiet-ifs.2018.5090&partnerID=40&md5=87c2634d4d0169fa853ab02e1b13605a","Department of Computer Engineering and Information Technology, College of Engineering, Pune, India","Bhadane, A., Department of Computer Engineering and Information Technology, College of Engineering, Pune, India; Mane, S.B., Department of Computer Engineering and Information Technology, College of Engineering, Pune, India",,"Computer crime; Electronic mail; Learning systems; Attack vector; Domain knowledge; E-mail servers; False positive rates; Practical use; Scoring techniques; Social engineering; Spear phishing; Anomaly detection","Bhadane, A.; Department of Computer Engineering and Information Technology, College of EngineeringIndia; email: aniketbhadane93@gmail.com",Article,"Final",,Scopus,2-s2.0-85062798773
"Kotkar V.A., Sucharita V.","56374684000;56708968600;","Particle filtering based opticle flow computation model for crowd anomaly detection using gaussian mixture model",2019,"International Journal of Recent Technology and Engineering","7","6",,"583","591",,,,"https://www.scopus.com/inward/record.uri?eid=2-s2.0-85065185244&partnerID=40&md5=b8129a9598d6946db756e39017f59f6e","Department of Computer Science & Engineering, K L University, Vijayawada, Andhra Pradesh, India; Department of Computer Science & Engineering, Narayana Engineering Colle0ge, Gudur, Andhra Pradesh, India","Kotkar, V.A., Department of Computer Science & Engineering, K L University, Vijayawada, Andhra Pradesh, India; Sucharita, V., Department of Computer Science & Engineering, Narayana Engineering Colle0ge, Gudur, Andhra Pradesh, India",,,,Article,"Final",,Scopus,2-s2.0-85065185244
"Liao D.-Y., Chen C.-Y., Tsai W.-P., Chen H.-T., Wu Y.-T., Chang S.-C.","7202026845;57204843400;57204845083;57204847723;57207919183;57154845200;","Anomaly detection for semiconductor tools using stacked autoencoder learning",2019,"IEEE International Symposium on Semiconductor Manufacturing Conference Proceedings","2018-December",, 8651179,"","",,,"10.1109/ISSM.2018.8651179","https://www.scopus.com/inward/record.uri?eid=2-s2.0-85063192206&doi=10.1109%2fISSM.2018.8651179&partnerID=40&md5=b040324624f4fa28440bcc6caa7a4e08","National Taiwan University, Taiwan; Taiwan Semiconductor Manufacturing Co., Taipei, Taiwan","Liao, D.-Y., National Taiwan University, Taiwan; Chen, C.-Y., National Taiwan University, Taiwan; Tsai, W.-P., Taiwan Semiconductor Manufacturing Co., Taipei, Taiwan; Chen, H.-T., Taiwan Semiconductor Manufacturing Co., Taipei, Taiwan; Wu, Y.-T., Taiwan Semiconductor Manufacturing Co., Taipei, Taiwan; Chang, S.-C., National Taiwan University, Taiwan",,"Chemical detection; Chemical vapor deposition; Learning systems; Semiconductor device manufacture; Sensory analysis; Auto encoders; Chemical vapor depositions (CVD); In-process; Multidimensional time; Real time; Semiconductor tools; Sensory data; Anomaly detection",,Conference Paper,"Final",,Scopus,2-s2.0-85063192206
"Song F., Diao Y., Read J., Stiegler A., Bifet A.","57204499877;18433629600;55200513300;57207772982;23093088900;","EXAD: A system for explainable anomaly detection on big data traces",2019,"IEEE International Conference on Data Mining Workshops, ICDMW","2018-November",, 8637456,"1435","1440",,,"10.1109/ICDMW.2018.00204","https://www.scopus.com/inward/record.uri?eid=2-s2.0-85062853900&doi=10.1109%2fICDMW.2018.00204&partnerID=40&md5=ca608152f285614222e5bb46786545cc","Inria, France; Ecole Polytechnique, Paris, France; Ecole Polytechnique, France; University of Massachusetts, Amherst, United States; LTCI, Télécom ParisTech, Paris, France","Song, F., Inria, France, Ecole Polytechnique, Paris, France; Diao, Y., Ecole Polytechnique, France, University of Massachusetts, Amherst, United States; Read, J., Ecole Polytechnique, France; Stiegler, A., Ecole Polytechnique, France; Bifet, A., LTCI, Télécom ParisTech, Paris, France","anomaly detection; machine learning; Spark","Big data; Data handling; Data mining; Electric sparks; Learning systems; Real time systems; Data systems; Data traces; Prototype system; Real time; Time-series data; Anomaly detection",,Conference Paper,"Final",,Scopus,2-s2.0-85062853900
"Su S., Sun Y., Gao X., Qiu J., Tian Z.","36644922800;56131604800;57205668632;36618093000;9636602700;","A correlation-change based feature selection method for IoT equipment anomaly detection",2019,"Applied Sciences (Switzerland)","9","3", 437,"","",,3,"10.3390/app9030437","https://www.scopus.com/inward/record.uri?eid=2-s2.0-85061048895&doi=10.3390%2fapp9030437&partnerID=40&md5=a1463c80829e4c9b2bb972d497d252db","Cyberspace Institute of Advanced Technology, Guangzhou University, Guangzhou, 510006, China; China Academy of Engineering Physics Institute of Computer Application, Mianyang, 621900, China","Su, S., Cyberspace Institute of Advanced Technology, Guangzhou University, Guangzhou, 510006, China; Sun, Y., Cyberspace Institute of Advanced Technology, Guangzhou University, Guangzhou, 510006, China; Gao, X., China Academy of Engineering Physics Institute of Computer Application, Mianyang, 621900, China; Qiu, J., Cyberspace Institute of Advanced Technology, Guangzhou University, Guangzhou, 510006, China; Tian, Z., Cyberspace Institute of Advanced Technology, Guangzhou University, Guangzhou, 510006, China","Correlation changes; Curve registration; feature selection; Sensor clustering",,"Qiu, J.; Cyberspace Institute of Advanced Technology, Guangzhou UniversityChina; email: qiujing@gzhu.edu.cn",Article,"Final",Open Access,Scopus,2-s2.0-85061048895
"Annapureddy R.R., Bhattacharya A.K., Niranjan Reddy M.","57192234258;7402635358;57207730706;","Adaptive Critic Design for Extreme Learning Machines applied to noisy and drifting industrial processes",2019,"Proceedings of the 2018 IEEE Symposium Series on Computational Intelligence, SSCI 2018",,, 8628664,"327","334",,1,"10.1109/SSCI.2018.8628664","https://www.scopus.com/inward/record.uri?eid=2-s2.0-85062787569&doi=10.1109%2fSSCI.2018.8628664&partnerID=40&md5=2a8662904585f2e141b04b24ee4d3371","School of Engineering Sciences, Mahindra École Centrale, Hyderabad, India","Annapureddy, R.R., School of Engineering Sciences, Mahindra École Centrale, Hyderabad, India; Bhattacharya, A.K., School of Engineering Sciences, Mahindra École Centrale, Hyderabad, India; Niranjan Reddy, M., School of Engineering Sciences, Mahindra École Centrale, Hyderabad, India","Adaptive Critic Systems; Artificial Neural Networks; Continuous-time systems; Extreme Learning Machines; process prediction and control; Steel Continuous Casting Process","Adaptive control systems; Continuous casting; Deterioration; Knowledge acquisition; Learning systems; Neural networks; Steel castings; Steelmaking; Adaptive critic; Adaptive critic designs; Continuous casting process; Continuous-time dynamics; Extreme learning machine; Industrial environments; Process prediction; Steel continuous castings; Continuous time systems",,Conference Paper,"Final",,Scopus,2-s2.0-85062787569
"Brady S., Magoni D., Murphy J., Assem H., Portillo-Dominguez A.O.","57195622038;6602567285;55678867800;55694486600;56242493600;","Analysis of Machine Learning Techniques for Anomaly Detection in the Internet of Things",2019,"2018 IEEE Latin American Conference on Computational Intelligence, LA-CCI 2018",,, 8625228,"","",,1,"10.1109/LA-CCI.2018.8625228","https://www.scopus.com/inward/record.uri?eid=2-s2.0-85062540341&doi=10.1109%2fLA-CCI.2018.8625228&partnerID=40&md5=f1e61a3ddeb90cd922a6dbfc122d9208","LeroUCD, University College, Dublin, Ireland; LaBRI, University of Bordeaux, France, France; Cognitive Computing Group, IBM, Dublin, Ireland","Brady, S., LeroUCD, University College, Dublin, Ireland; Magoni, D., LaBRI, University of Bordeaux, France, France; Murphy, J., LeroUCD, University College, Dublin, Ireland; Assem, H., Cognitive Computing Group, IBM, Dublin, Ireland; Portillo-Dominguez, A.O., LeroUCD, University College, Dublin, Ireland","Anomaly Detection; Comparative Study; Internet of Things; Machine Learning","Anomaly detection; Learning systems; Machine learning; Comparative studies; Internet of thing (IOT); IOT networks; Machine learning techniques; Real time; State-of-the-art techniques; Usage scenarios; Internet of things",,Conference Paper,"Final",,Scopus,2-s2.0-85062540341
"Onal A.C., Berat Sezer O., Ozbayoglu M., Dogdu E.","57193615320;57151392500;57208585716;6603501593;","MIS-IoT: Modular Intelligent Server Based Internet of Things Framework with Big Data and Machine Learning",2019,"Proceedings - 2018 IEEE International Conference on Big Data, Big Data 2018",,, 8622247,"2270","2279",,1,"10.1109/BigData.2018.8622247","https://www.scopus.com/inward/record.uri?eid=2-s2.0-85062621180&doi=10.1109%2fBigData.2018.8622247&partnerID=40&md5=d4ca378272fc591b9d3078c01b80b072","Department of Computer Engineering, TOBB University of Economics and Technology, Ankara, 06560, Turkey; Department of Computer Engineering, Cankaya University, Ankara, 06790, Turkey","Onal, A.C., Department of Computer Engineering, TOBB University of Economics and Technology, Ankara, 06560, Turkey; Berat Sezer, O., Department of Computer Engineering, TOBB University of Economics and Technology, Ankara, 06560, Turkey; Ozbayoglu, M., Department of Computer Engineering, TOBB University of Economics and Technology, Ankara, 06560, Turkey; Dogdu, E., Department of Computer Engineering, Cankaya University, Ankara, 06790, Turkey","anomaly detection; big data analytics; fault detection; Internet of things; machine learning","Anomaly detection; Big data; Data Analytics; Data handling; Deep learning; Fault detection; Learning systems; Machine learning; Design and implementations; Learning methods; Real time; Server-based; Service Oriented; Weather data; Web protocols; Internet of things",,Conference Paper,"Final",,Scopus,2-s2.0-85062621180
"Sun B.B., Zielonka E., Fritz A., Schofield M., Ringel B., Armstrong B., Ho S.-S., Breitzman A., Snouffer J., Kirschner J., Davis K.","35726937100;57207571466;57203972752;57207567704;57207575186;57207583260;7403713899;6505794015;57207574669;57207572923;57207579070;","Visual Analytics for Real-Time Flight Behavior Threat Assessment",2019,"Proceedings - 2018 IEEE International Conference on Big Data, Big Data 2018",,, 8622086,"3607","3612",,,"10.1109/BigData.2018.8622086","https://www.scopus.com/inward/record.uri?eid=2-s2.0-85062604230&doi=10.1109%2fBigData.2018.8622086&partnerID=40&md5=f369bc016f3ab99ab56470df55df26be","Dept. of Computer Science, Rowan University, Glassboro, NJ, United States; ASRC Federal Mission Solutions, Moorestown, NJ, United States","Sun, B.B., Dept. of Computer Science, Rowan University, Glassboro, NJ, United States; Zielonka, E., Dept. of Computer Science, Rowan University, Glassboro, NJ, United States; Fritz, A., Dept. of Computer Science, Rowan University, Glassboro, NJ, United States; Schofield, M., Dept. of Computer Science, Rowan University, Glassboro, NJ, United States; Ringel, B., Dept. of Computer Science, Rowan University, Glassboro, NJ, United States; Armstrong, B., Dept. of Computer Science, Rowan University, Glassboro, NJ, United States; Ho, S.-S., Dept. of Computer Science, Rowan University, Glassboro, NJ, United States; Breitzman, A., Dept. of Computer Science, Rowan University, Glassboro, NJ, United States; Snouffer, J., ASRC Federal Mission Solutions, Moorestown, NJ, United States; Kirschner, J., ASRC Federal Mission Solutions, Moorestown, NJ, United States; Davis, K., ASRC Federal Mission Solutions, Moorestown, NJ, United States","anomaly detection; data visualization; visual analytics","Air traffic control; Air transportation; Aircraft detection; Anomaly detection; Big data; Learning systems; Visualization; Air traffic controller; Data driven decision; Flight anomalies; Integrated tools; Machine learning techniques; Real-time data; Threat assessment; Visual analytics; Data visualization",,Conference Paper,"Final",,Scopus,2-s2.0-85062604230
"Yamaguchi T., As M., Mine T.","57206664833;57193410491;7102520998;","Prediction of Bus Delay over Intervals on Various Kinds of Routes Using Bus Probe Data",2019,"Proceedings - 5th IEEE/ACM International Conference on Big Data Computing, Applications and Technologies, BDCAT 2018",,, 8606640,"97","106",,,"10.1109/BDCAT.2018.00020","https://www.scopus.com/inward/record.uri?eid=2-s2.0-85061786597&doi=10.1109%2fBDCAT.2018.00020&partnerID=40&md5=556eddee5ed27e05ef981e903b039e76","Department of Advanced Information Technology, Graduate School of Information Science and Electrical Engineering, Kyushu University, Fukuoka, 819-0395, Japan; Department of Advanced Information Technology, Faculty of Information Science and Electrical Engineering, Kyushu University, Fukuoka, 819-0395, Japan","Yamaguchi, T., Department of Advanced Information Technology, Graduate School of Information Science and Electrical Engineering, Kyushu University, Fukuoka, 819-0395, Japan; As, M., Department of Advanced Information Technology, Graduate School of Information Science and Electrical Engineering, Kyushu University, Fukuoka, 819-0395, Japan; Mine, T., Department of Advanced Information Technology, Faculty of Information Science and Electrical Engineering, Kyushu University, Fukuoka, 819-0395, Japan","Bus delay prediction; Bus Probe Data; Machine Learning; Outlier detection","Adaptive boosting; Anomaly detection; Big data; Bus terminals; Bus transportation; Data mining; Decision trees; Forecasting; Learning systems; Machine learning; Neural networks; Probes; Real time systems; Traffic control; Travel time; Automatic vehicle locations; Bus delays; Bus probe datum; Gradient boosting; Machine learning models; Prediction model; Real-time data; Support vector regression (SVR); Buses",,Conference Paper,"Final",,Scopus,2-s2.0-85061786597
"Vanem E., Brandsater A.","10140700000;6506345833;","Cluster-based anomaly detection in condition monitoring of a marine engine system",2019,"Proceedings - 2018 Prognostics and System Health Management Conference, PHM-Chongqing 2018",,, 8603319,"20","31",,,"10.1109/PHM-Chongqing.2018.00011","https://www.scopus.com/inward/record.uri?eid=2-s2.0-85061830572&doi=10.1109%2fPHM-Chongqing.2018.00011&partnerID=40&md5=f5f098cf61a2c8b60d4c59b46f26d059","Group Technology and Research, DNV GL, Høvik, Norway; Department of Mathematics, University of Oslo, Oslo, Norway","Vanem, E., Group Technology and Research, DNV GL, Høvik, Norway, Department of Mathematics, University of Oslo, Oslo, Norway; Brandsater, A., Group Technology and Research, DNV GL, Høvik, Norway, Department of Mathematics, University of Oslo, Oslo, Norway","Anomaly detection; Condition monitoring; Data-driven methods; Sensors; Unsupervised learning","Condition monitoring; Conformal mapping; Data mining; Diesel engines; Fault detection; K-means clustering; Marine engines; Self organizing maps; Sensors; Systems engineering; Unsupervised learning; Cluster based approach; Cluster-based methods; Data-driven methods; Density-based Clustering; Marine Diesel Engines; Normal operating conditions; Online anomaly detection; Unsupervised approaches; Anomaly detection",,Conference Paper,"Final",,Scopus,2-s2.0-85061830572
"Poghosyan A., Grigoryan N., Kushmerick N., Beybutyan H., Harutyunyan A.","55946421800;35147909400;6701794486;57205882398;57200866782;","Identifying changed or sick resources from logs",2019,"Proceedings - 2018 IEEE 3rd International Workshops on Foundations and Applications of Self* Systems, FAS*W 2018",,, 8599537,"86","91",,,"10.1109/FAS-W.2018.00030","https://www.scopus.com/inward/record.uri?eid=2-s2.0-85061553486&doi=10.1109%2fFAS-W.2018.00030&partnerID=40&md5=ec854cc46f3add03857e563edcb2718f","Office of the CTO of Cloud Management, VMware, United States","Poghosyan, A., Office of the CTO of Cloud Management, VMware, United States; Grigoryan, N., Office of the CTO of Cloud Management, VMware, United States; Kushmerick, N., Office of the CTO of Cloud Management, VMware, United States; Beybutyan, H., Office of the CTO of Cloud Management, VMware, United States; Harutyunyan, A., Office of the CTO of Cloud Management, VMware, United States","'sick' log source; Anomaly detection; Automated log management; Change detection; Machine learning","Anomaly detection; Learning systems; Machine learning; Problem solving; 'sick' log source; Behavioral patterns; Change detection; Cloud infrastructures; Complex distributed system; Log managements; Machine learning techniques; Prototype algorithms; Population statistics",,Conference Paper,"Final",,Scopus,2-s2.0-85061553486
"Ariyaluran Habeeb R.A., Nasaruddin F., Gani A., Amanullah M.A., Abaker Targio Hashem I., Ahmed E., Imran M.","57203807223;25825479800;7003355320;57209326612;57209332807;55727310000;57198098049;","Clustering-based real-time anomaly detection—A breakthrough in big data technologies",2019,"Transactions on Emerging Telecommunications Technologies",,, e3647,"","",,1,"10.1002/ett.3647","https://www.scopus.com/inward/record.uri?eid=2-s2.0-85067384452&doi=10.1002%2fett.3647&partnerID=40&md5=08cfed2f90508fc93a6b1b56761a5da6","Department of Information System, Faculty of Computer Science and Information Technology, University of Malaya, Kuala Lumpur, Malaysia; School of Computing & Information Technology, Taylor's University, Subang Jaya, Malaysia; Research & Innovation Development, Telekom Research & Development Sdn Bhd, Cyberjaya, Malaysia; Centre for Mobile Cloud Computing Research (C4MCCR), University of Malaya, Malaysia; College of Applied Computer Science, King Saud University, Riyadh, Saudi Arabia; Department of Computer System & Technology, Faculty of Computer Science and Information Technology University of Malaya, Kuala Lumpur, Malaysia","Ariyaluran Habeeb, R.A., Department of Information System, Faculty of Computer Science and Information Technology, University of Malaya, Kuala Lumpur, Malaysia; Nasaruddin, F., Department of Information System, Faculty of Computer Science and Information Technology, University of Malaya, Kuala Lumpur, Malaysia; Gani, A., Department of Computer System & Technology, Faculty of Computer Science and Information Technology University of Malaya, Kuala Lumpur, Malaysia; Amanullah, M.A., Research & Innovation Development, Telekom Research & Development Sdn Bhd, Cyberjaya, Malaysia; Abaker Targio Hashem, I., School of Computing & Information Technology, Taylor's University, Subang Jaya, Malaysia; Ahmed, E., Centre for Mobile Cloud Computing Research (C4MCCR), University of Malaya, Malaysia; Imran, M., College of Applied Computer Science, King Saud University, Riyadh, Saudi Arabia",,"Batch data processing; Big data; K-means clustering; Learning systems; Adjusted rand index; Agglomerative clustering; Comparative analysis; Density based spatial clustering of applications with noise; Local Outlier Factor; Real time network data; Real-time anomaly detections; Spectral clustering; Anomaly detection","Ariyaluran Habeeb, R.A.; Department of Information System, Faculty of Computer Science and Information Technology, University of MalayaMalaysia; email: riyazahd@siswa.um.edu.my",Article,"Article in Press",,Scopus,2-s2.0-85067384452
