Authors,Author(s) ID,Title,Year,Source title,Volume,Issue,Art. No.,Page start,Page end,Page count,Cited by,DOI,Link,Affiliations,Authors with affiliations,Author Keywords,Index Keywords,Correspondence Address,Document Type,Publication Stage,Access Type,Source,EID
"Milo M.W., Roan M.J.","55953729000;6602076129;","Detecting anomalous patterns in time-series data using sparse hierarchically parameterized transition matrices",2017,"Pattern Analysis and Applications","20","4",,"1029","1043",,,"10.1007/s10044-016-0544-0","https://www.scopus.com/inward/record.uri?eid=2-s2.0-84964319751&doi=10.1007%2fs10044-016-0544-0&partnerID=40&md5=ea23c2b88933f1a08ccb8aeb93e9b31a","Mechanical Engineering, Virginia Tech, 111 Randolph Hall, Blacksburg, VA  24060, United States","Milo, M.W., Mechanical Engineering, Virginia Tech, 111 Randolph Hall, Blacksburg, VA  24060, United States; Roan, M.J., Mechanical Engineering, Virginia Tech, 111 Randolph Hall, Blacksburg, VA  24060, United States","Machine learning; Markov processes; Monte Carlo; Pattern recognition; Real-time systems; Signal processing; Statistical models; Stochastic processes",,"Roan, M.J.; Mechanical Engineering, Virginia Tech, 111 Randolph Hall, United States; email: mroan@vt.edu",Article,"Final",,Scopus,2-s2.0-84964319751
"Odesile A., Thamilarasu G.","57194405899;22636037300;","Distributed intrusion detection using mobile agents in wireless body area networks",2017,"Proceedings - 2017 7th International Conference on Emerging Security Technologies, EST 2017",,, 8090414,"144","149",,2,"10.1109/EST.2017.8090414","https://www.scopus.com/inward/record.uri?eid=2-s2.0-85041242326&doi=10.1109%2fEST.2017.8090414&partnerID=40&md5=813593e27741e2878911c4a91e6f1590","Computing and Software Systems, University of Washington Bothell, Bothell, WA  98011, United States","Odesile, A., Computing and Software Systems, University of Washington Bothell, Bothell, WA  98011, United States; Thamilarasu, G., Computing and Software Systems, University of Washington Bothell, Bothell, WA  98011, United States",,"Autonomous agents; Biomedical equipment; Diagnosis; Energy utilization; Health care; Hospital data processing; Intrusion detection; Learning algorithms; Learning systems; Mercury (metal); Network security; Patient monitoring; Patient treatment; Real time systems; Wearable technology; Wireless local area networks (WLAN); Wireless networks; Autonomous mobile agent; Distributed intrusion detection; Health care application; Implanted medical devices; Intrusion Detection Systems; Low energy consumption; Technological advances; Wireless body area network; Mobile agents",,Conference Paper,"Final",,Scopus,2-s2.0-85041242326
"Dromard J., Owezarski P.","53871367600;6603543053;","Integrating Short History for Improving Clustering Based Network Traffic Anomaly Detection",2017,"Proceedings - 2017 IEEE 2nd International Workshops on Foundations and Applications of Self* Systems, FAS*W 2017",,, 8064128,"227","234",,2,"10.1109/FAS-W.2017.152","https://www.scopus.com/inward/record.uri?eid=2-s2.0-85035208722&doi=10.1109%2fFAS-W.2017.152&partnerID=40&md5=1f7f7ca978629a9bac364ce7498f06bd","LAAS-CNRS, Université de Toulouse, CNRS, Toulouse, France","Dromard, J., LAAS-CNRS, Université de Toulouse, CNRS, Toulouse, France; Owezarski, P., LAAS-CNRS, Université de Toulouse, CNRS, Toulouse, France","anomaly detection; clustering; Communication networks; ground truth; Spark Streaming; traffic history","Clustering algorithms; Learning systems; Telecommunication networks; Anomaly detection; clustering; Clustering techniques; Ground truth; Network administrator; Post-processing stages; Traffic anomaly detections; Unsupervised machine learning; HIgh speed networks",,Conference Paper,"Final",,Scopus,2-s2.0-85035208722
"Seo S., Park S., Hwang I., Kim J.","57200090952;57193380083;57200090203;35069662300;","ADSTREAM: Anomaly detection in large-scale data streams using local outlier factor based on micro-cluster",2017,"Advanced Science Letters","23","10",,"10204","10209",,1,"10.1166/asl.2017.10419","https://www.scopus.com/inward/record.uri?eid=2-s2.0-85039435125&doi=10.1166%2fasl.2017.10419&partnerID=40&md5=32a87a45cc773c5e8c15d4949963dd89","Department of Computer Engineering, Dongguk University, Seoul, South Korea","Seo, S., Department of Computer Engineering, Dongguk University, Seoul, South Korea; Park, S., Department of Computer Engineering, Dongguk University, Seoul, South Korea; Hwang, I., Department of Computer Engineering, Dongguk University, Seoul, South Korea; Kim, J., Department of Computer Engineering, Dongguk University, Seoul, South Korea","Anomaly detection; Large-scale data stream; Local outlier factor; Micro cluster",,"Kim, J.; Department of Computer Engineering, Dongguk UniversitySouth Korea",Article,"Final",,Scopus,2-s2.0-85039435125
"Chou J.-S., Ngo N.-T., Chong W.K.","35772399000;56808955500;9239759500;","The use of artificial intelligence combiners for modeling steel pitting risk and corrosion rate",2017,"Engineering Applications of Artificial Intelligence","65",,,"471","483",,14,"10.1016/j.engappai.2016.09.008","https://www.scopus.com/inward/record.uri?eid=2-s2.0-85008656047&doi=10.1016%2fj.engappai.2016.09.008&partnerID=40&md5=98fdaab74aeee1ee4d2e42735cced426","Department of Civil and Construction Engineering, National Taiwan University of Science and Technology, 43, Sec. 4, Keelung Rd., Taipei, 106, Taiwan; Faculty of Project Management, The University of Danang –University of Science and Technology, 54 Nguyen Luong Bang, Danang, Viet Nam; Del E. Webb School of Construction, School of Sustainable Engineering and the Built Environment, Arizona State University, Tempe, AZ  85287, United States","Chou, J.-S., Department of Civil and Construction Engineering, National Taiwan University of Science and Technology, 43, Sec. 4, Keelung Rd., Taipei, 106, Taiwan; Ngo, N.-T., Department of Civil and Construction Engineering, National Taiwan University of Science and Technology, 43, Sec. 4, Keelung Rd., Taipei, 106, Taiwan, Faculty of Project Management, The University of Danang –University of Science and Technology, 54 Nguyen Luong Bang, Danang, Viet Nam; Chong, W.K., Del E. Webb School of Construction, School of Sustainable Engineering and the Built Environment, Arizona State University, Tempe, AZ  85287, United States","Artificial intelligence; Corrosion rate; Engineering application; Machine learning; Meta ensemble; Metaheuristic regression; Pitting risk","Artificial intelligence; Carbon; Carbon steel; Complex networks; Composite structures; Concretes; Corrosion rate; Electrochemical corrosion; Forecasting; Learning systems; Marine engineering; Neural networks; Optimization; Pitting; Regression analysis; Reinforced concrete; Seawater corrosion; Classification and regression tree; Engineering applications; Mean absolute percentage error; Meta ensemble; Meta-heuristic optimizations; Metaheuristic; Steel reinforced concrete; Support vector regression (SVR); Corrosion","Chou, J.-S.; Department of Civil and Construction Engineering, National Taiwan University of Science and Technology, 43, Sec. 4, Keelung Rd., Taiwan; email: jschou@mail.ntust.edu.tw",Article,"Final",,Scopus,2-s2.0-85008656047
"Meng F.J., Zhang X., Chen P., Xu J.M.","24470253800;57196397230;55490244700;56109884200;","DriftInsight: Detecting Anomalous Behaviors in Large-Scale Cloud Platform",2017,"IEEE International Conference on Cloud Computing, CLOUD","2017-June",, 8030593,"230","237",,4,"10.1109/CLOUD.2017.37","https://www.scopus.com/inward/record.uri?eid=2-s2.0-85032195502&doi=10.1109%2fCLOUD.2017.37&partnerID=40&md5=ee22aac901d486f9ff98aa396b0ebea4","IBM Research-China, Beijing, China; Xi'an Jiaotong University, China","Meng, F.J., IBM Research-China, Beijing, China; Zhang, X., IBM Research-China, Beijing, China, Xi'an Jiaotong University, China; Chen, P., IBM Research-China, Beijing, China; Xu, J.M., IBM Research-China, Beijing, China","anomaly detection; behavior model; cloud computing; unsupervised clustering","Platform as a Service (PaaS); Anomalous behavior; Anomaly detection; Behavior model; Evaluation results; Monitoring metrics; Production environments; Service Level Agreements; Unsupervised clustering; Cloud computing",,Conference Paper,"Final",,Scopus,2-s2.0-85032195502
"Siddique K., Akhtar Z., Lee H.-G., Kim W., Kim Y.","57191228422;46661628200;13611137900;55492061300;22333904700;","Toward bulk synchronous parallel-based machine learning techniques for anomaly detection in high-speed big data networks",2017,"Symmetry","9","9", 197,"","",,7,"10.3390/sym9090197","https://www.scopus.com/inward/record.uri?eid=2-s2.0-85035051379&doi=10.3390%2fsym9090197&partnerID=40&md5=93008833efe06a8e29b837fc21ecd9a3","Department of Information and Communication Engineering, Dongguk University, Seoul, 04620, South Korea; INRS-EMT, University of Quebec, Montreal, QC  H5A 1K6, Canada; Korea Institute of Science and Technology Information, Daejeon, 34141, South Korea","Siddique, K., Department of Information and Communication Engineering, Dongguk University, Seoul, 04620, South Korea; Akhtar, Z., INRS-EMT, University of Quebec, Montreal, QC  H5A 1K6, Canada; Lee, H.-G., Korea Institute of Science and Technology Information, Daejeon, 34141, South Korea; Kim, W., Department of Information and Communication Engineering, Dongguk University, Seoul, 04620, South Korea; Kim, Y., Department of Information and Communication Engineering, Dongguk University, Seoul, 04620, South Korea","Anomaly detection; Big data; Bulk synchronous parallel; DARPA; ISCX-UNB dataset; KDD Cup 99; Machine learning; Network intrusion detection systems",,"Kim, Y.; Department of Information and Communication Engineering, Dongguk UniversitySouth Korea; email: ywkim@dongguk.edu",Article,"Final",Open Access,Scopus,2-s2.0-85035051379
"Iglesias J.A., Ledezma A., Sanchis A., Angelov P.","55751744105;6507061932;7004052541;7003690831;","Real-time recognition of calling pattern and behaviour of mobile phone users through anomaly detection and dynamically-evolving clustering",2017,"Applied Sciences (Switzerland)","7","8", 798,"","",,3,"10.3390/app7080798","https://www.scopus.com/inward/record.uri?eid=2-s2.0-85027097849&doi=10.3390%2fapp7080798&partnerID=40&md5=9fff6d78b5b8e87dd21d26f486ac96a9","Computer Science Department, Carlos III University of Madrid, Leganés, Madrid, 28918, Spain; Computing and Communications Department, Lancaster University, Lancaster, LA14 WA, United Kingdom","Iglesias, J.A., Computer Science Department, Carlos III University of Madrid, Leganés, Madrid, 28918, Spain; Ledezma, A., Computer Science Department, Carlos III University of Madrid, Leganés, Madrid, 28918, Spain; Sanchis, A., Computer Science Department, Carlos III University of Madrid, Leganés, Madrid, 28918, Spain; Angelov, P., Computing and Communications Department, Lancaster University, Lancaster, LA14 WA, United Kingdom","Analysing calling behaviour; Clustering; Detecting outliers; Evolving systems; Human activity recognition",,"Iglesias, J.A.; Computer Science Department, Carlos III University of MadridSpain; email: jiglesia@inf.uc3m.es",Article,"Final",Open Access,Scopus,2-s2.0-85027097849
"Le T., Gibb S., Pham N., La H.M., Falk L., Berendsen T.","57195425443;57192651693;57191858131;34881978000;57195419594;57195419507;","Autonomous robotic system using non-destructive evaluation methods for bridge deck inspection",2017,"Proceedings - IEEE International Conference on Robotics and Automation",,, 7989421,"3672","3677",,11,"10.1109/ICRA.2017.7989421","https://www.scopus.com/inward/record.uri?eid=2-s2.0-85027977406&doi=10.1109%2fICRA.2017.7989421&partnerID=40&md5=3f3a9ac45895dd2ac2d5184973450af7","Advanced Robotics and Automation (ARA) Lab, Department of Computer Science and Engineering, University of Nevada, Reno, NV  89557, United States; Department of Mechanical Engineering, University of Nevada, Reno, NV  89557, United States","Le, T., Advanced Robotics and Automation (ARA) Lab, Department of Computer Science and Engineering, University of Nevada, Reno, NV  89557, United States; Gibb, S., Advanced Robotics and Automation (ARA) Lab, Department of Computer Science and Engineering, University of Nevada, Reno, NV  89557, United States; Pham, N., Advanced Robotics and Automation (ARA) Lab, Department of Computer Science and Engineering, University of Nevada, Reno, NV  89557, United States; La, H.M., Advanced Robotics and Automation (ARA) Lab, Department of Computer Science and Engineering, University of Nevada, Reno, NV  89557, United States; Falk, L., Advanced Robotics and Automation (ARA) Lab, Department of Computer Science and Engineering, University of Nevada, Reno, NV  89557, United States; Berendsen, T., Department of Mechanical Engineering, University of Nevada, Reno, NV  89557, United States",,"Acoustic emission testing; Automation; Bridge decks; Cost effectiveness; Costs; Geological surveys; Ground penetrating radar systems; Inspection; Learning systems; Machine design; Pattern recognition; Pattern recognition systems; Robotics; Steel bridges; Autonomous robotic systems; Bridge deck inspections; Bridge deterioration; Condition assessments; Ground penetrating radar (GPR); Inadequate maintenance; Non-destructive evaluation methods; Pattern recognition method; Nondestructive examination","La, H.M.; Advanced Robotics and Automation (ARA) Lab, Department of Computer Science and Engineering, University of NevadaUnited States; email: hla@unr.edu",Conference Paper,"Final",,Scopus,2-s2.0-85027977406
"Huang S., Fung C., Liu C., Zhang S., Wei G., Luan Z., Qian D.","57188864311;14037341800;56200751000;57195410950;57199964272;7004392634;7102355459;","Arena: Adaptive real-time update anomaly prediction in cloud systems",2017,"2017 13th International Conference on Network and Service Management, CNSM 2017","2018-January",,,"1","9",,,"10.23919/CNSM.2017.8256031","https://www.scopus.com/inward/record.uri?eid=2-s2.0-85046648712&doi=10.23919%2fCNSM.2017.8256031&partnerID=40&md5=e5c7e883631315d502e008fea2165b62","Sino-German Joint Software Institute, Beihang University, Beijing, China; Computer Science Department, Virginia Commonwealth University, Richmond, VA, United States; Microsoft Research, Beijing, China; Carnegie Mellon University, Pittsburgh, PA, United States","Huang, S., Sino-German Joint Software Institute, Beihang University, Beijing, China, Microsoft Research, Beijing, China; Fung, C., Computer Science Department, Virginia Commonwealth University, Richmond, VA, United States; Liu, C., Carnegie Mellon University, Pittsburgh, PA, United States; Zhang, S., Sino-German Joint Software Institute, Beihang University, Beijing, China; Wei, G., Sino-German Joint Software Institute, Beihang University, Beijing, China; Luan, Z., Sino-German Joint Software Institute, Beihang University, Beijing, China; Qian, D., Sino-German Joint Software Institute, Beihang University, Beijing, China",,"Clustering algorithms; Efficiency; Expert systems; Forecasting; Monitoring; Software engineering; Anomaly detection; Anomaly predictions; Clustering techniques; Component based systems; Monitoring points; Prediction accuracy; Prediction performance; Real-time updates; Real time systems",,Conference Paper,"Final",,Scopus,2-s2.0-85046648712
"Sun F., Dubey A., White J.","57190380784;57198233972;55492761300;","DxNAT - Deep neural networks for explaining non-recurring traffic congestion",2017,"Proceedings - 2017 IEEE International Conference on Big Data, Big Data 2017","2018-January",,,"2141","2150",,5,"10.1109/BigData.2017.8258162","https://www.scopus.com/inward/record.uri?eid=2-s2.0-85047811322&doi=10.1109%2fBigData.2017.8258162&partnerID=40&md5=a99f6bc30fb91c46208694c40de39823","Institute for Software Integrated Systems, Vanderbilt University, Nashville, TN, United States","Sun, F., Institute for Software Integrated Systems, Vanderbilt University, Nashville, TN, United States; Dubey, A., Institute for Software Integrated Systems, Vanderbilt University, Nashville, TN, United States; White, J., Institute for Software Integrated Systems, Vanderbilt University, Nashville, TN, United States","anomaly detection; deep learning; neural network; public transportation; traffic congestion","Big data; Deep learning; Deep neural networks; Learning algorithms; Network layers; Neural networks; Personnel training; Sports; Anomaly detection; Crossover operator; Machine learning techniques; Public transportation; Real time traffics; Receiver operating characteristic analysis; Traditional approaches; Training data sets; Traffic congestion",,Conference Paper,"Final",,Scopus,2-s2.0-85047811322
"Rivetti N., Busnel Y., Gal A.","57193410771;17433741600;7201834671;","Grand challenge: Flinkman - Anomaly detection in manufacturing equipment with apache flink",2017,"DEBS 2017 - Proceedings of the 11th ACM International Conference on Distributed Event-Based Systems",,,,"274","279",,1,"10.1145/3093742.3095099","https://www.scopus.com/inward/record.uri?eid=2-s2.0-85023182369&doi=10.1145%2f3093742.3095099&partnerID=40&md5=d2b5c0597b545771571c03348f480202","Technion - Israel Institute of Technology, Israel; IMT Atlantique, IRISA, UBL, France","Rivetti, N., Technion - Israel Institute of Technology, Israel; Busnel, Y., IMT Atlantique, IRISA, UBL, France; Gal, A., Technion - Israel Institute of Technology, Israel","Anomaly detection; Clustering; Linked-Data; Markov chains; Stream processing","Manufacture; Markov processes; Program processors; Software architecture; Anomaly detection; Clustering; Data parallelization; End to end latencies; Linked datum; Manufacturing equipment; Memory intensive tasks; Stream processing; Signal detection",,Conference Paper,"Final",,Scopus,2-s2.0-85023182369
"Domb M., Bonchek-Dokow E., Leshem G.","57193775015;16549085200;37057651300;","Lightweight adaptive Random-Forest for IoT rule generation and execution",2017,"Journal of Information Security and Applications","34",,,"218","224",,7,"10.1016/j.jisa.2017.03.001","https://www.scopus.com/inward/record.uri?eid=2-s2.0-85016447649&doi=10.1016%2fj.jisa.2017.03.001&partnerID=40&md5=27b8345349f86d163904c4adb7587218","Computer Science Department, Ashkelon Academic College, Yitzchak Ben Tzvi 12, Ashkelon, Israel","Domb, M., Computer Science Department, Ashkelon Academic College, Yitzchak Ben Tzvi 12, Ashkelon, Israel; Bonchek-Dokow, E., Computer Science Department, Ashkelon Academic College, Yitzchak Ben Tzvi 12, Ashkelon, Israel; Leshem, G., Computer Science Department, Ashkelon Academic College, Yitzchak Ben Tzvi 12, Ashkelon, Israel","Active learning; Internet of Things; Random-Forest; Rules extraction; Security","Artificial intelligence; Data handling; Decision trees; Digital storage; Intrusion detection; Learning systems; Machine components; Network security; Active Learning; Data security and privacy; Execution framework; Random forests; Real-time anomaly detections; Rules extraction; Security; Security frameworks; Internet of things","Domb, M.; Computer Science Department, Ashkelon Academic College, Yitzchak Ben Tzvi 12, Ashkelon, Israel; email: dombmnc@acad.ash-college.ac.il",Article,"Final",,Scopus,2-s2.0-85016447649
"Zhang J., Jones K., Song T., Kang H., Brown D.E.","57195130264;57195135532;57195126586;57040226300;57202998030;","Comparing unsupervised learning approaches to detect network intrusion using NetFlow data",2017,"2017 Systems and Information Engineering Design Symposium, SIEDS 2017",,, 7937701,"122","127",,2,"10.1109/SIEDS.2017.7937701","https://www.scopus.com/inward/record.uri?eid=2-s2.0-85025692141&doi=10.1109%2fSIEDS.2017.7937701&partnerID=40&md5=b4106764470488889c230794bdb48531","Data Science Institute, University of Virginia, United States; University of Virginia, United States","Zhang, J., Data Science Institute, University of Virginia, United States; Jones, K., Data Science Institute, University of Virginia, United States; Song, T., Data Science Institute, University of Virginia, United States; Kang, H., Data Science Institute, University of Virginia, United States; Brown, D.E., University of Virginia, United States","Anomaly Detection; Machine Learning; Network Security; Unsupervised Learning","Intrusion detection; Learning systems; Unsupervised learning; Anomaly detection; Local outlier factors; Network intrusion detection; Network intrusions; Real-time traffic datum; Signature based ids; University of Virginia; Unsupervised techniques; Network security",,Conference Paper,"Final",,Scopus,2-s2.0-85025692141
"Aydin O., Guldamlasioglu S.","57191414455;57191223978;","Using LSTM networks to predict engine condition on large scale data processing framework",2017,"2017 4th International Conference on Electrical and Electronics Engineering, ICEEE 2017",,, 7935834,"281","285",,11,"10.1109/ICEEE2.2017.7935834","https://www.scopus.com/inward/record.uri?eid=2-s2.0-85025632141&doi=10.1109%2fICEEE2.2017.7935834&partnerID=40&md5=4b831e107cca5480bb47cdded9ece5e5","Big Data Research and Development Group, STM Defense Technologies Engineering and Trade Inc., Ankara, Turkey","Aydin, O., Big Data Research and Development Group, STM Defense Technologies Engineering and Trade Inc., Ankara, Turkey; Guldamlasioglu, S., Big Data Research and Development Group, STM Defense Technologies Engineering and Trade Inc., Ankara, Turkey","ANN; Apache spark; Big data; LSTM; Predictive maintenance","Cost reduction; Customer satisfaction; Data handling; Distributed computer systems; Engines; Forecasting; Internet of things; Maintenance; Markov processes; NASA; Optimization; Distributed clustering; Internet of things technologies; Large-scale data processing; LSTM; Machine learning approaches; Optimization algorithms; Predictive maintenance; Technological environment; Big data",,Conference Paper,"Final",,Scopus,2-s2.0-85025632141
"Zhang J., Tong Y., Xu M., Qin T.","56075130400;54935571900;15764009500;57201521305;","A Method for Data Collection and Real-Time Anomaly Detection of Lightweight Hosts",2017,"Hsi-An Chiao Tung Ta Hsueh/Journal of Xi'an Jiaotong University","51","4",,"97","102",,1,"10.7652/xjtuxb201704015","https://www.scopus.com/inward/record.uri?eid=2-s2.0-85026219339&doi=10.7652%2fxjtuxb201704015&partnerID=40&md5=c4f998e0856014f5726fcfd143d72280","System Research Department, Wuhan Digital Engineering Institute, Wuhan, 430074, China; System Software Department, Wuhan Digital Engineering Institute, Wuhan, 430074, China; School of Electronic and Information Engineering, Xi'an Jiaotong University, Xi'an, 710049, China","Zhang, J., System Research Department, Wuhan Digital Engineering Institute, Wuhan, 430074, China; Tong, Y., System Research Department, Wuhan Digital Engineering Institute, Wuhan, 430074, China; Xu, M., System Software Department, Wuhan Digital Engineering Institute, Wuhan, 430074, China; Qin, T., School of Electronic and Information Engineering, Xi'an Jiaotong University, Xi'an, 710049, China","Anomaly detection; Clustering method; Mobile agent; Principal component analysis","Cluster analysis; Mobile agents; Principal component analysis; Signal detection; Anomaly detection; Anomaly detection methods; Clustering methods; Conventional methods; Intelligent mobile agent; Online anomaly detection; Principal component analysis method; Real-time anomaly detections; Data acquisition","Tong, Y.; System Research Department, Wuhan Digital Engineering InstituteChina",Article,"Final",,Scopus,2-s2.0-85026219339
