Authors,Author(s) ID,Title,Year,Source title,Volume,Issue,Art. No.,Page start,Page end,Page count,Cited by,DOI,Link,Affiliations,Authors with affiliations,Author Keywords,Index Keywords,Correspondence Address,Document Type,Publication Stage,Access Type,Source,EID
"Parveen P., Lee M., Henslee A., Dugan M., Ford B.","23490153900;57202432708;57202433183;57202437068;57202436732;","Partition-aware scalable outlier detection using unsupervised learning",2018,"Proceedings - 2018 IEEE 19th International Conference on Information Reuse and Integration for Data Science, IRI 2018",,, 8424706,"186","192",,,"10.1109/IRI.2018.00035","https://www.scopus.com/inward/record.uri?eid=2-s2.0-85052324697&doi=10.1109%2fIRI.2018.00035&partnerID=40&md5=377e304b476740860fe8248f0f4c2799","AT and T Chief Data Office, Richardson, TX, United States","Parveen, P., AT and T Chief Data Office, Richardson, TX, United States; Lee, M., AT and T Chief Data Office, Richardson, TX, United States; Henslee, A., AT and T Chief Data Office, Richardson, TX, United States; Dugan, M., AT and T Chief Data Office, Richardson, TX, United States; Ford, B., AT and T Chief Data Office, Richardson, TX, United States","Auto-Encoder; Clustering; Outlier; Support vector machine; Unsupervised learning","Big data; Image retrieval; Information use; Statistics; Support vector machines; Unsupervised learning; Anomaly detection frameworks; Auto encoders; Clustering; Density-based spatial clustering of applications with noise; Human intervention; Outlier; Outlier Detection; Unsupervised approaches; Data integration",,Conference Paper,"Final",,Scopus,2-s2.0-85052324697
"El Chamie M., Lore K.G., Shila D.M., Surana A.","55972349000;57190128995;55663475500;6602087409;","Physics-Based Features for Anomaly Detection in Power Grids with Micro-PMUs",2018,"IEEE International Conference on Communications","2018-May",, 8423024,"","",,,"10.1109/ICC.2018.8423024","https://www.scopus.com/inward/record.uri?eid=2-s2.0-85051443961&doi=10.1109%2fICC.2018.8423024&partnerID=40&md5=ad39fc579bc51fed4abd70bf3427ea44","Department, United Technologies Research Center, 411 Silver Ln, East Hartford, CT  06118, United States","El Chamie, M., Department, United Technologies Research Center, 411 Silver Ln, East Hartford, CT  06118, United States; Lore, K.G., Department, United Technologies Research Center, 411 Silver Ln, East Hartford, CT  06118, United States; Shila, D.M., Department, United Technologies Research Center, 411 Silver Ln, East Hartford, CT  06118, United States; Surana, A., Department, United Technologies Research Center, 411 Silver Ln, East Hartford, CT  06118, United States",,"Electric fault currents; Feature extraction; Learning algorithms; Learning systems; Phasor measurement units; Signal detection; Anomaly-detection algorithms; Detection performance; Distribution lines; Electrical monitoring; Single line to ground faults; Traditional techniques; Transient property; Transmission grids; Electric power transmission networks",,Conference Paper,"Final",,Scopus,2-s2.0-85051443961
"Hameed H., Mazhar S., Hassan N.","57200853686;57121389800;57200162581;","Real-time road anomaly detection, using an on-board data logger",2018,"IEEE Vehicular Technology Conference","2018-June",,,"1","5",,,"10.1109/VTCSpring.2018.8417780","https://www.scopus.com/inward/record.uri?eid=2-s2.0-85050962237&doi=10.1109%2fVTCSpring.2018.8417780&partnerID=40&md5=10a3b4f958f3f366e049e2a56f1c1398","Computer Science Department, Information Technology University, Lahore, Pakistan","Hameed, H., Computer Science Department, Information Technology University, Lahore, Pakistan; Mazhar, S., Computer Science Department, Information Technology University, Lahore, Pakistan; Hassan, N., Computer Science Department, Information Technology University, Lahore, Pakistan","data logging; FNR = False Negative Rate; FPR = False Positive Rate; heterogeneous data set; Machine Learning; road anomalies; Roadway Surface Disruptions; TPR= True Positive Rate","Artificial intelligence; Classification (of information); Data acquisition; Information retrieval; Learning systems; Roads and streets; Vehicles; Data logging; False negative rate; False positive rates; Heterogeneous data; Road anomalies; Roadway surfaces; True positive rates; Digital storage","Hameed, H.; Computer Science Department, Information Technology UniversityPakistan; email: hadia.hameed@itu.edu.pk",Conference Paper,"Final",,Scopus,2-s2.0-85050962237
"Debnath B., Solaimani M., Gulzar M.A.G., Arora N., Lumezanu C., Xu J., Zong B., Zhang H., Jiang G., Khan L.","24469971600;56109265400;57189494454;57211126754;15755630400;57189854559;57203221691;35520557000;12244201300;57203196379;","LogLens: A real-time log analysis system",2018,"Proceedings - International Conference on Distributed Computing Systems","2018-July",,,"1052","1062",,3,"10.1109/ICDCS.2018.00105","https://www.scopus.com/inward/record.uri?eid=2-s2.0-85050995087&doi=10.1109%2fICDCS.2018.00105&partnerID=40&md5=ba57086fdc30901460be395ce7cdddfc","NEC Laboratories America, Inc., Princeton, NJ, United States; NEC Laboratories America, Inc., United States; CS Department, University of Texas at Dallas, United States; Ant Financial, Hangzhou, China","Debnath, B., NEC Laboratories America, Inc., Princeton, NJ, United States; Solaimani, M., NEC Laboratories America, Inc., United States; Gulzar, M.A.G., NEC Laboratories America, Inc., United States; Arora, N., NEC Laboratories America, Inc., United States; Lumezanu, C., NEC Laboratories America, Inc., Princeton, NJ, United States; Xu, J., NEC Laboratories America, Inc., Princeton, NJ, United States; Zong, B., NEC Laboratories America, Inc., Princeton, NJ, United States; Zhang, H., NEC Laboratories America, Inc., United States, Ant Financial, Hangzhou, China; Jiang, G., NEC Laboratories America, Inc., United States, Ant Financial, Hangzhou, China; Khan, L., CS Department, University of Texas at Dallas, United States","Anomaly Detection; Big Data Processing; Distributed Computing; Event Driven Compution; Log Analysis; Log Parsing; Log Sequence Violation; Real time system; Spark; Unsupervised Learning","Big data; Data handling; Electric sparks; Interactive computer systems; Learning systems; Real time systems; Unsupervised learning; Anomaly detection; Event-driven; Log analysis; Log Parsing; Log Sequence Violation; Distributed computer systems",,Conference Paper,"Final",,Scopus,2-s2.0-85050995087
"Yu W., Cheng W., Aggarwal C.C., Zhang K., Chen H., Wang W.","57188803893;24174157800;7006797289;55619308777;35241923100;55157954300;","NetWalk: A flexible deep embedding approach for anomaly detection in dynamic networks",2018,"Proceedings of the ACM SIGKDD International Conference on Knowledge Discovery and Data Mining",,,,"2672","2681",,13,"10.1145/3219819.3220024","https://www.scopus.com/inward/record.uri?eid=2-s2.0-85051530430&doi=10.1145%2f3219819.3220024&partnerID=40&md5=47f4a6419f94f0699f2c59d9c7d0222a","Department of Computer Science, University of California Los Angeles, United States; NEC Laboratories America, Inc., United States; IBM Research AI, United States; Department of Computer and Information Sciences, Temple University, United States","Yu, W., Department of Computer Science, University of California Los Angeles, United States; Cheng, W., NEC Laboratories America, Inc., United States; Aggarwal, C.C., IBM Research AI, United States; Zhang, K., Department of Computer and Information Sciences, Temple University, United States; Chen, H., NEC Laboratories America, Inc., United States; Wang, W., Department of Computer Science, University of California Los Angeles, United States","Anomaly detection; Clique embedding; Deep autoencoder; Dynamic network embedding","Learning systems; Vector spaces; Anomaly detection; Auto encoders; Clique embedding; Dynamic environments; Dynamic network; Low-dimensional representation; Network representation; Vector representations; Data mining",,Conference Paper,"Final",,Scopus,2-s2.0-85051530430
"Li Y., Ma Y., Guo M., Li S.","57203828483;55711440900;57203242890;55741066500;","Anomaly detection for power grid flow patterns based on the multi-restricted Boltzmann machines",2018,"Proceedings - 2018 IEEE 3rd International Conference on Data Science in Cyberspace, DSC 2018",,, 8411921,"628","633",,,"10.1109/DSC.2018.00100","https://www.scopus.com/inward/record.uri?eid=2-s2.0-85051041238&doi=10.1109%2fDSC.2018.00100&partnerID=40&md5=e41dcdec38124f6085042d73f098e98d","School of Cyber Security, Shanghai Jiao Tong University, Shanghai, 200240, China","Li, Y., School of Cyber Security, Shanghai Jiao Tong University, Shanghai, 200240, China; Ma, Y., School of Cyber Security, Shanghai Jiao Tong University, Shanghai, 200240, China; Guo, M., School of Cyber Security, Shanghai Jiao Tong University, Shanghai, 200240, China; Li, S., School of Cyber Security, Shanghai Jiao Tong University, Shanghai, 200240, China","Anomaly detection; Clustering; Intrusion detection; Restricted Boltzmann machine","Computers; Electric power system economics; Electric power system security; Intrusion detection; Anomaly detection; Clustering; Network anomalies; Power grid securities; Restricted boltzmann machine; Traffic anomalies; Traffic detection; Unsupervised algorithms; Electric power transmission networks",,Conference Paper,"Final",,Scopus,2-s2.0-85051041238
"Putina A., Barth S., Bifet A., Pletcher D., Precup C., Nivaggioli P., Rossi D.","57203007980;57203142638;23093088900;57203150789;56490906900;57203147511;7103169618;","Unsupervised real-time detection of BGP anomalies leveraging high-rate and fine-grained telemetry data",2018,"INFOCOM 2018 - IEEE Conference on Computer Communications Workshops",,,,"1","2",,1,"10.1109/INFCOMW.2018.8406838","https://www.scopus.com/inward/record.uri?eid=2-s2.0-85050668987&doi=10.1109%2fINFCOMW.2018.8406838&partnerID=40&md5=1f2ed5099862dc0ff38174a570616f2e","Telecom ParisTech, France; Cisco Systems, France","Putina, A., Telecom ParisTech, France; Barth, S., Cisco Systems, France; Bifet, A., Telecom ParisTech, France; Pletcher, D., Cisco Systems, France; Precup, C., Cisco Systems, France; Nivaggioli, P., Cisco Systems, France; Rossi, D., Telecom ParisTech, France",,"Learning systems; Signal detection; Telemetering equipment; Anomaly detection; Large scale testbed; Machine learning techniques; Real applications; Real-time detection; Technology evolution; Unsupervised clustering technique; Wealth of information; Border Gateway Protocol",,Conference Paper,"Final",,Scopus,2-s2.0-85050668987
"Zaman M., Lung C.-H.","36476855000;13613176100;","Evaluation of machine learning techniques for network intrusion detection",2018,"IEEE/IFIP Network Operations and Management Symposium: Cognitive Management in a Cyber World, NOMS 2018",,,,"1","5",,5,"10.1109/NOMS.2018.8406212","https://www.scopus.com/inward/record.uri?eid=2-s2.0-85050700411&doi=10.1109%2fNOMS.2018.8406212&partnerID=40&md5=63ded65594ab514a1a16b249892d4736","Systems and Computer Engineering, Carleton University, Ottawa, ON, Canada","Zaman, M., Systems and Computer Engineering, Carleton University, Ottawa, ON, Canada; Lung, C.-H., Systems and Computer Engineering, Carleton University, Ottawa, ON, Canada","Intrusion Detection System; Machine learning; Network Security","Computer crime; Intrusion detection; Learning algorithms; Learning systems; Radial basis function networks; Anomaly detection; Information entropy; Intrusion Detection Systems; Machine learning techniques; Network intrusion detection; Radial Basis Function(RBF); Real time network; Receiver operating curves; Network security",,Conference Paper,"Final",,Scopus,2-s2.0-85050700411
"Tandiya N., Jauhar A., Marojevic V., Reed J.H.","57203024668;57203013939;23389583500;7403641959;","Deep Predictive Coding Neural Network for RF Anomaly Detection in Wireless Networks",2018,"2018 IEEE International Conference on Communications Workshops, ICC Workshops 2018 - Proceedings",,,,"1","6",,2,"10.1109/ICCW.2018.8403654","https://www.scopus.com/inward/record.uri?eid=2-s2.0-85050297166&doi=10.1109%2fICCW.2018.8403654&partnerID=40&md5=952edf5a390956a50160240e744409e7","Wireless at Virginia Tech, Bradley Department of Electrical and Computer Engineering, Virginia Tech, Blacksburg, VA, United States","Tandiya, N., Wireless at Virginia Tech, Bradley Department of Electrical and Computer Engineering, Virginia Tech, Blacksburg, VA, United States; Jauhar, A., Wireless at Virginia Tech, Bradley Department of Electrical and Computer Engineering, Virginia Tech, Blacksburg, VA, United States; Marojevic, V., Wireless at Virginia Tech, Bradley Department of Electrical and Computer Engineering, Virginia Tech, Blacksburg, VA, United States; Reed, J.H., Wireless at Virginia Tech, Bradley Department of Electrical and Computer Engineering, Virginia Tech, Blacksburg, VA, United States","Anomaly detection; Deep predictive coding network; Machine learning","Classification (of information); Codes (symbols); Control system synthesis; Deep neural networks; Image coding; Intrusion detection; Learning systems; Statistical tests; Wireless networks; Anomaly detection; Anomaly detection methods; Autonomous vehicle control; Mission-critical communication; Predictive coding; Radio frequency spectrum; Signature based detection techniques; Spectral correlation function; Network coding",,Conference Paper,"Final",,Scopus,2-s2.0-85050297166
"Luo Y., Du X., Sun Y.","57208553291;26324832600;57208902988;","Survey on real-Time anomaly detection technology for big data streams",2018,"Proceedings of the International Conference on Anti-Counterfeiting, Security and Identification, ASID","2018-November",, 8693216,"26","30",,1,"10.1109/ICASID.2018.8693216","https://www.scopus.com/inward/record.uri?eid=2-s2.0-85065069865&doi=10.1109%2fICASID.2018.8693216&partnerID=40&md5=6159bd4df2b33350834cc685aa1fb754","Henan Provincial Key Laboratory of Information Security Information Science and Technology Institute, Zhengzhou, 450004, China","Luo, Y., Henan Provincial Key Laboratory of Information Security Information Science and Technology Institute, Zhengzhou, 450004, China; Du, X., Henan Provincial Key Laboratory of Information Security Information Science and Technology Institute, Zhengzhou, 450004, China; Sun, Y., Henan Provincial Key Laboratory of Information Security Information Science and Technology Institute, Zhengzhou, 450004, China","big data stream; Massive Online Analysis (MOA); outlier; real-Time anomaly detection","Big data; Birds; Clustering algorithms; Data mining; Data stream; Development prospects; Experimental testing; Literature analysis method; Network environments; On-line analysis; outlier; Real-time anomaly detections; Anomaly detection","Luo, Y.; Henan Provincial Key Laboratory of Information Security Information Science and Technology InstituteChina; email: luoyuanyan7l7@163.com",Conference Paper,"Final",,Scopus,2-s2.0-85065069865
"Muller S., Lancrenon J., Harpes C., Le Traon Y., Gombault S., Bonnin J.-M.","57191264192;26644216700;36086323300;55884641800;56205213700;7004899658;","A training-resistant anomaly detection system",2018,"Computers and Security","76",,,"1","11",,7,"10.1016/j.cose.2018.02.015","https://www.scopus.com/inward/record.uri?eid=2-s2.0-85043535080&doi=10.1016%2fj.cose.2018.02.015&partnerID=40&md5=400df909e4461ea99054accdc422a558","itrust consulting s.à r.l., Niederanven, Luxembourg; University of Luxembourg, Luxembourg, Luxembourg; IMT Atlantique, IRISA, UBL, Rennes, Bretagne, France","Muller, S., itrust consulting s.à r.l., Niederanven, Luxembourg; Lancrenon, J., itrust consulting s.à r.l., Niederanven, Luxembourg; Harpes, C., itrust consulting s.à r.l., Niederanven, Luxembourg; Le Traon, Y., University of Luxembourg, Luxembourg, Luxembourg; Gombault, S., IMT Atlantique, IRISA, UBL, Rennes, Bretagne, France; Bonnin, J.-M., IMT Atlantique, IRISA, UBL, Rennes, Bretagne, France","Anomaly detection; Intrusion detection system; Machine learning; Network security; Training attack","Artificial intelligence; Computer crime; Denial-of-service attack; Learning systems; Mercury (metal); Network security; Telecommunication traffic; Anomaly detection; Anomaly detection systems; Denial of Service; Detection scheme; Intrusion Detection Systems; Learning process; Network intrusion detection systems; Traffic anomalies; Intrusion detection","Muller, S.; itrust consulting s.à r.l.Luxembourg; email: steve.muller@itrust.lu",Article,"Final",,Scopus,2-s2.0-85043535080
"Aggarwal C.C.","7006797289;","Extracting real-time insights from graphs and social streams",2018,"41st International ACM SIGIR Conference on Research and Development in Information Retrieval, SIGIR 2018",,,,"1339","",,,"10.1145/3209978.3210212","https://www.scopus.com/inward/record.uri?eid=2-s2.0-85051457779&doi=10.1145%2f3209978.3210212&partnerID=40&md5=475a933ea9e08f7d2dcd0b919d2d4eba","IBM T. J. Watson Research Center, Yorktown Heights, United States","Aggarwal, C.C., IBM T. J. Watson Research Center, Yorktown Heights, United States","Graph streams; Social streams","Information retrieval; Information services; Anomaly detection; Event detection; Graph streams; Information networks; Link prediction; Real time analysis; Social streams; Streaming applications; Data mining","Aggarwal, C.C.; IBM T. J. Watson Research CenterUnited States; email: charu@us.ibm.com",Conference Paper,"Final",,Scopus,2-s2.0-85051457779
"Chow C.W.K., Liu J., Li J., Swain N., Reid K., Saint C.P.","35291328300;8416110900;57193306418;57192317344;57201795799;7003330915;","Development of smart data analytics tools to support wastewater treatment plant operation",2018,"Chemometrics and Intelligent Laboratory Systems","177",,,"140","150",,5,"10.1016/j.chemolab.2018.03.006","https://www.scopus.com/inward/record.uri?eid=2-s2.0-85046118373&doi=10.1016%2fj.chemolab.2018.03.006&partnerID=40&md5=ce4ba59ab81a3e3e7e29e062a93e1741","Natural and Built Environments Research Centre, School of Natural and Built Environments, University of South Australia, Mawson Lakes, South Australia, Australia; School of Information Technology and Mathematical Sciences, University of South Australia, Mawson Lakes, South Australia, Australia; SA Water, Adelaide, South Australia, Australia","Chow, C.W.K., Natural and Built Environments Research Centre, School of Natural and Built Environments, University of South Australia, Mawson Lakes, South Australia, Australia; Liu, J., School of Information Technology and Mathematical Sciences, University of South Australia, Mawson Lakes, South Australia, Australia; Li, J., School of Information Technology and Mathematical Sciences, University of South Australia, Mawson Lakes, South Australia, Australia; Swain, N., SA Water, Adelaide, South Australia, Australia; Reid, K., SA Water, Adelaide, South Australia, Australia; Saint, C.P., Natural and Built Environments Research Centre, School of Natural and Built Environments, University of South Australia, Mawson Lakes, South Australia, Australia","Data analytics; Event detection; Online monitoring; UV–Vis spectroscopy; Wastewater treatment process","water; algorithm; Article; automated pattern recognition; data analytics; environmental reclamation; information processing; online monitoring; priority journal; waste water management; waste water treatment plant; water quality","Chow, C.W.K.; Natural and Built Environments Research Centre, School of Natural and Built Environments, University of South AustraliaAustralia; email: christopher.chow@unisa.edu.au",Article,"Final",,Scopus,2-s2.0-85046118373
"Tavares G.M., Turrisi Da Costa V.G., Martins V.E., Ceravolo P., Barbon S., Jr.","57200260509;57205445800;57205440528;6506416314;57212560486;","Anomaly detection in business process based on data stream mining",2018,"ACM International Conference Proceeding Series",,,,"120","127",,,"10.1145/3229345.3229362","https://www.scopus.com/inward/record.uri?eid=2-s2.0-85060022507&doi=10.1145%2f3229345.3229362&partnerID=40&md5=109d66746e216a97657f94d5c7a1e313","State University of Londrina, UEL, Londrina, Brazil; Università degli Studi di Milano (UNIMI), Crema, Italy","Tavares, G.M., State University of Londrina, UEL, Londrina, Brazil; Turrisi Da Costa, V.G., State University of Londrina, UEL, Londrina, Brazil; Martins, V.E., State University of Londrina, UEL, Londrina, Brazil; Ceravolo, P., Università degli Studi di Milano (UNIMI), Crema, Italy; Barbon, S., Jr., State University of Londrina, UEL, Londrina, Brazil","Business Process Modelling; Clustering; Fraud; Online; Process Mining","Information use; Process monitoring; Systems engineering; Business process modelling; Clustering; Fraud; Online; Process mining; Information systems",,Conference Paper,"Final",,Scopus,2-s2.0-85060022507
"Matam B.R., Duncan H.","32667901500;21233403600;","Technical challenges related to implementation of a formula one real time data acquisition and analysis system in a paediatric intensive care unit",2018,"Journal of Clinical Monitoring and Computing","32","3",,"559","569",,3,"10.1007/s10877-017-0047-6","https://www.scopus.com/inward/record.uri?eid=2-s2.0-85026896827&doi=10.1007%2fs10877-017-0047-6&partnerID=40&md5=799b410a0b7a2367dbc4b0b76c134a76","Birmingham Children’s Hospital, NHSFT, Steelhouse Lane, Birmingham, B4 6NH, United Kingdom; Aston University, Aston Triangle, Birmingham, B4 7ET, United Kingdom","Matam, B.R., Birmingham Children’s Hospital, NHSFT, Steelhouse Lane, Birmingham, B4 6NH, United Kingdom, Aston University, Aston Triangle, Birmingham, B4 7ET, United Kingdom; Duncan, H., Birmingham Children’s Hospital, NHSFT, Steelhouse Lane, Birmingham, B4 6NH, United Kingdom","Critical care; Data recording system; New clinical data storage system; Technical challenges","Automobile electronic equipment; Continuous time systems; Data acquisition; Data recording; Digital storage; Intensive care units; Pediatrics; Physiology; Real time systems; Clinical data; Critical care; Data recording systems; Intensive care environments; McLaren Electronic Systems; Real time data acquisition; Significant deteriorations; Technical challenges; Monitoring; algorithm; Article; data base; electrocardiogram; human; information processing; intensive care; machine learning; medical ethics; pediatric intensive care unit; plethysmography; priority journal; program feasibility; retrospective study; risk assessment; signal processing; vital sign; waveform; adolescent; child; computer; computer system; devices; electrocardiography; infant; length of stay; newborn; pediatrics; physiologic monitoring; preschool child; procedures; software; Adolescent; Algorithms; Child; Child, Preschool; Computer Systems; Computers; Critical Care; Electrocardiography; Humans; Infant; Infant, Newborn; Intensive Care Units, Pediatric; Length of Stay; Monitoring, Physiologic; Pediatrics; Retrospective Studies; Risk Assessment; Software","Matam, B.R.; Birmingham Children’s Hospital, NHSFT, Steelhouse Lane, United Kingdom; email: t-matambr@aston.ac.uk",Article,"Final",Open Access,Scopus,2-s2.0-85026896827
"Xie K., Li X., Wang X., Cao J., Xie G., Wen J., Zhang D., Qin Z.","35169847700;57196353947;55619294413;7403354073;13604674800;14021819300;7405358081;55625158400;","On-Line Anomaly Detection with High Accuracy",2018,"IEEE/ACM Transactions on Networking","26","3",,"1222","1235",,17,"10.1109/TNET.2018.2819507","https://www.scopus.com/inward/record.uri?eid=2-s2.0-85046366323&doi=10.1109%2fTNET.2018.2819507&partnerID=40&md5=8d66f85695440164d9985bcd0efbc219","College of Computer Science and Electronics Engineering, Hunan University, Changsha, 410006, China; CAS Key Laboratory of Network Data Science and Technology, Institute of Computing Technology, Chinese Academy of Sciences, Beijing, China; Department of Electrical and Computer Engineering, State University of New York at Stony Brook, Stony Brook, NY  11794, United States; Department of Computing, Hong Kong Polytechnic University, Hong Kong; Network Research Center, Institute of Computing Technology, Chinese Academy of Sciences, Beijing, 100190, China","Xie, K., College of Computer Science and Electronics Engineering, Hunan University, Changsha, 410006, China, CAS Key Laboratory of Network Data Science and Technology, Institute of Computing Technology, Chinese Academy of Sciences, Beijing, China, Department of Electrical and Computer Engineering, State University of New York at Stony Brook, Stony Brook, NY  11794, United States; Li, X., College of Computer Science and Electronics Engineering, Hunan University, Changsha, 410006, China; Wang, X., Department of Electrical and Computer Engineering, State University of New York at Stony Brook, Stony Brook, NY  11794, United States; Cao, J., Department of Computing, Hong Kong Polytechnic University, Hong Kong; Xie, G., Network Research Center, Institute of Computing Technology, Chinese Academy of Sciences, Beijing, 100190, China; Wen, J., Network Research Center, Institute of Computing Technology, Chinese Academy of Sciences, Beijing, 100190, China; Zhang, D., College of Computer Science and Electronics Engineering, Hunan University, Changsha, 410006, China; Qin, Z., College of Computer Science and Electronics Engineering, Hunan University, Changsha, 410006, China","Anomaly detection; bilateral PCA; on-line algorithm","Approximation algorithms; Clustering algorithms; Costs; Data mining; Data structures; Digital storage; Feature extraction; Financial data processing; Iterative methods; Matrix algebra; Monitoring; Signal detection; Anomaly detection; Anomaly-detection algorithms; Approximate algorithms; bilateral PCA; High dimensional data; On-line algorithms; Sparse matrices; Traffic anomaly detections; Principal component analysis","Xie, K.; College of Computer Science and Electronics Engineering, Hunan UniversityChina; email: xiekun@hnu.edu.cn",Article,"Final",,Scopus,2-s2.0-85046366323
